<?xml version="1.0" encoding="UTF-8"?>
<cloudloop-config xmlns:xsi="http://www.w3.org/2001/XMLSchema-instance" xsi:noNamespaceSchemaLocation="cloudloop-config.xsd">
  <logger-config-file>logger-config-file</logger-config-file>
  <adapters/>
  <stores>
    <default-store>default-store</default-store>
    <store>
      <name>name</name>
      <adapter>adapter</adapter>
    </store>
  </stores>
  <encryption>
    <preferred-key>preferred-key</preferred-key>
  </encryption>
</cloudloop-config>
